{
 "gerado_em": "2026-10-08",
 "fonte": "OpenDota explorer (api.opendota.com/api/explorer), partidas profissionais (leagueid) dos patches 7.40 e 7.41",
 "metodo": "OpenDota explorer (api.opendota.com/api/explorer), duas consultas SQL sobre o dataset publico, cada uma retornando todos os herois de uma vez (sem precisar de uma chamada por heroi). Partidas: profissionais (matches.leagueid IS NOT NULL) nos patches 7.40 e 7.41 (match_patch.patch IN ('7.40','7.41')), 15.958 partidas no total (7.943 em 7.40 e 8.015 em 7.41 por match_patch). Posicao por partida: lane_role do OpenDota (1 safelane, 2 mid, 3 offlane; linhas sem lane_role classificado ficam fora). Na safelane, o jogador do time com maior gold_per_min vira pos1 e o de menor gpm vira pos5; na offlane, maior gpm = pos3 e menor = pos4; lane_role=2 (mid) e sempre pos2. Quando a safelane ou offlane do time tem mais de 2 jogadores classificados (laning atipico, ex. dual lane), o(s) jogador(es) do meio do ranking de gpm ficam fora da distribuicao (nem pos1/5 nem pos3/4), entao posicoes.n_total pode ser menor que o total de partidas do heroi no periodo. fracao = n da posicao dividido por posicoes.n_total. is_roaming nao foi usado para separar posicao porque nao distingue pos4 de pos5 sozinho; fica implicito no efeito sobre o gpm do jogador. Forca por heroi: media simples por partida-jogador (todas as posicoes juntas) de gold_per_min, tower_damage, hero_damage, hero_healing e stuns (colunas do OpenDota). duracao_media_vitorias_min = duracao media (em minutos) das partidas que esse heroi venceu. vitoria_por_duracao agrupa a duracao da partida (matches.duration) em menos de 30 min, 30 a 40 min e mais de 40 min, com taxa de vitoria e n em cada faixa. slug de cada heroi = constants/heroes.json (OpenDota) com o prefixo npc_dota_hero_ removido, igual ao usado em content/pro_dados.",
 "herois": [
  {
   "hero_id": 1,
   "slug": "antimage",
   "posicoes": {
    "n_total": 441,
    "distribuicao": {
     "pos1": {
      "n": 403,
      "fracao": 0.9138
     },
     "pos2": {
      "n": 6,
      "fracao": 0.0136
     },
     "pos3": {
      "n": 30,
      "fracao": 0.068
     },
     "pos4": {
      "n": 0,
      "fracao": 0.0
     },
     "pos5": {
      "n": 2,
      "fracao": 0.0045
     }
    }
   },
   "forca": {
    "n": 442,
    "gpm_medio": 643.6629,
    "dano_torre_medio": 5053.6991,
    "dano_heroi_medio": 17934.3416,
    "cura_media": 10.2805,
    "stuns_medio_s": 8.0035,
    "duracao_media_vitorias_min": 32.8494,
    "vitoria_por_duracao": {
     "menos_30min": {
      "n": 190,
      "taxa": 0.4895
     },
     "entre_30_40min": {
      "n": 174,
      "taxa": 0.4598
     },
     "mais_40min": {
      "n": 78,
      "taxa": 0.5128
     }
    }
   }
  },
  {
   "hero_id": 2,
   "slug": "axe",
   "posicoes": {
    "n_total": 2014,
    "distribuicao": {
     "pos1": {
      "n": 3,
      "fracao": 0.0015
     },
     "pos2": {
      "n": 14,
      "fracao": 0.007
     },
     "pos3": {
      "n": 1909,
      "fracao": 0.9479
     },
     "pos4": {
      "n": 63,
      "fracao": 0.0313
     },
     "pos5": {
      "n": 25,
      "fracao": 0.0124
     }
    }
   },
   "forca": {
    "n": 2019,
    "gpm_medio": 516.6127,
    "dano_torre_medio": 703.2556,
    "dano_heroi_medio": 20336.6459,
    "cura_media": 37.3735,
    "stuns_medio_s": 42.444,
    "duracao_media_vitorias_min": 34.7445,
    "vitoria_por_duracao": {
     "menos_30min": {
      "n": 785,
      "taxa": 0.4981
     },
     "entre_30_40min": {
      "n": 705,
      "taxa": 0.5191
     },
     "mais_40min": {
      "n": 529,
      "taxa": 0.4896
     }
    }
   }
  },
  {
   "hero_id": 3,
   "slug": "bane",
   "posicoes": {
    "n_total": 851,
    "distribuicao": {
     "pos1": {
      "n": 0,
      "fracao": 0.0
     },
     "pos2": {
      "n": 25,
      "fracao": 0.0294
     },
     "pos3": {
      "n": 0,
      "fracao": 0.0
     },
     "pos4": {
      "n": 123,
      "fracao": 0.1445
     },
     "pos5": {
      "n": 703,
      "fracao": 0.8261
     }
    }
   },
   "forca": {
    "n": 857,
    "gpm_medio": 289.4212,
    "dano_torre_medio": 188.5531,
    "dano_heroi_medio": 10074.7631,
    "cura_media": 170.993,
    "stuns_medio_s": 82.6624,
    "duracao_media_vitorias_min": 38.4163,
    "vitoria_por_duracao": {
     "menos_30min": {
      "n": 201,
      "taxa": 0.5672
     },
     "entre_30_40min": {
      "n": 298,
      "taxa": 0.5772
     },
     "mais_40min": {
      "n": 358,
      "taxa": 0.5196
     }
    }
   }
  },
  {
   "hero_id": 4,
   "slug": "bloodseeker",
   "posicoes": {
    "n_total": 166,
    "distribuicao": {
     "pos1": {
      "n": 147,
      "fracao": 0.8855
     },
     "pos2": {
      "n": 5,
      "fracao": 0.0301
     },
     "pos3": {
      "n": 13,
      "fracao": 0.0783
     },
     "pos4": {
      "n": 1,
      "fracao": 0.006
     },
     "pos5": {
      "n": 0,
      "fracao": 0.0
     }
    }
   },
   "forca": {
    "n": 166,
    "gpm_medio": 603.5723,
    "dano_torre_medio": 3779.8554,
    "dano_heroi_medio": 24209.3193,
    "cura_media": 30.3072,
    "stuns_medio_s": 2.1273,
    "duracao_media_vitorias_min": 33.9763,
    "vitoria_por_duracao": {
     "menos_30min": {
      "n": 79,
      "taxa": 0.481
     },
     "entre_30_40min": {
      "n": 46,
      "taxa": 0.413
     },
     "mais_40min": {
      "n": 41,
      "taxa": 0.5122
     }
    }
   }
  },
  {
   "hero_id": 5,
   "slug": "crystal_maiden",
   "posicoes": {
    "n_total": 1331,
    "distribuicao": {
     "pos1": {
      "n": 0,
      "fracao": 0.0
     },
     "pos2": {
      "n": 6,
      "fracao": 0.0045
     },
     "pos3": {
      "n": 2,
      "fracao": 0.0015
     },
     "pos4": {
      "n": 57,
      "fracao": 0.0428
     },
     "pos5": {
      "n": 1266,
      "fracao": 0.9512
     }
    }
   },
   "forca": {
    "n": 1342,
    "gpm_medio": 296.7615,
    "dano_torre_medio": 239.2548,
    "dano_heroi_medio": 10439.8316,
    "cura_media": 91.5708,
    "stuns_medio_s": 50.6869,
    "duracao_media_vitorias_min": 30.2548,
    "vitoria_por_duracao": {
     "menos_30min": {
      "n": 748,
      "taxa": 0.4973
     },
     "entre_30_40min": {
      "n": 469,
      "taxa": 0.5203
     },
     "mais_40min": {
      "n": 125,
      "taxa": 0.424
     }
    }
   }
  },
  {
   "hero_id": 6,
   "slug": "drow_ranger",
   "posicoes": {
    "n_total": 1003,
    "distribuicao": {
     "pos1": {
      "n": 983,
      "fracao": 0.9801
     },
     "pos2": {
      "n": 13,
      "fracao": 0.013
     },
     "pos3": {
      "n": 3,
      "fracao": 0.003
     },
     "pos4": {
      "n": 0,
      "fracao": 0.0
     },
     "pos5": {
      "n": 4,
      "fracao": 0.004
     }
    }
   },
   "forca": {
    "n": 1009,
    "gpm_medio": 622.8404,
    "dano_torre_medio": 6586.775,
    "dano_heroi_medio": 23754.1269,
    "cura_media": 25.0932,
    "stuns_medio_s": 0.1255,
    "duracao_media_vitorias_min": 36.1703,
    "vitoria_por_duracao": {
     "menos_30min": {
      "n": 338,
      "taxa": 0.4941
     },
     "entre_30_40min": {
      "n": 351,
      "taxa": 0.49
     },
     "mais_40min": {
      "n": 320,
      "taxa": 0.4875
     }
    }
   }
  },
  {
   "hero_id": 7,
   "slug": "earthshaker",
   "posicoes": {
    "n_total": 415,
    "distribuicao": {
     "pos1": {
      "n": 4,
      "fracao": 0.0096
     },
     "pos2": {
      "n": 246,
      "fracao": 0.5928
     },
     "pos3": {
      "n": 94,
      "fracao": 0.2265
     },
     "pos4": {
      "n": 68,
      "fracao": 0.1639
     },
     "pos5": {
      "n": 3,
      "fracao": 0.0072
     }
    }
   },
   "forca": {
    "n": 418,
    "gpm_medio": 502.8349,
    "dano_torre_medio": 1084.8421,
    "dano_heroi_medio": 21632.2249,
    "cura_media": 92.0215,
    "stuns_medio_s": 110.8631,
    "duracao_media_vitorias_min": 36.7214,
    "vitoria_por_duracao": {
     "menos_30min": {
      "n": 158,
      "taxa": 0.4114
     },
     "entre_30_40min": {
      "n": 132,
      "taxa": 0.4924
     },
     "mais_40min": {
      "n": 128,
      "taxa": 0.4453
     }
    }
   }
  },
  {
   "hero_id": 8,
   "slug": "juggernaut",
   "posicoes": {
    "n_total": 961,
    "distribuicao": {
     "pos1": {
      "n": 956,
      "fracao": 0.9948
     },
     "pos2": {
      "n": 0,
      "fracao": 0.0
     },
     "pos3": {
      "n": 3,
      "fracao": 0.0031
     },
     "pos4": {
      "n": 1,
      "fracao": 0.001
     },
     "pos5": {
      "n": 1,
      "fracao": 0.001
     }
    }
   },
   "forca": {
    "n": 965,
    "gpm_medio": 639.5078,
    "dano_torre_medio": 6824.3938,
    "dano_heroi_medio": 18857.1285,
    "cura_media": 6183.3212,
    "stuns_medio_s": 0.7597,
    "duracao_media_vitorias_min": 32.4974,
    "vitoria_por_duracao": {
     "menos_30min": {
      "n": 472,
      "taxa": 0.4682
     },
     "entre_30_40min": {
      "n": 320,
      "taxa": 0.5719
     },
     "mais_40min": {
      "n": 173,
      "taxa": 0.5087
     }
    }
   }
  },
  {
   "hero_id": 9,
   "slug": "mirana",
   "posicoes": {
    "n_total": 794,
    "distribuicao": {
     "pos1": {
      "n": 35,
      "fracao": 0.0441
     },
     "pos2": {
      "n": 80,
      "fracao": 0.1008
     },
     "pos3": {
      "n": 10,
      "fracao": 0.0126
     },
     "pos4": {
      "n": 281,
      "fracao": 0.3539
     },
     "pos5": {
      "n": 388,
      "fracao": 0.4887
     }
    }
   },
   "forca": {
    "n": 801,
    "gpm_medio": 374.4894,
    "dano_torre_medio": 632.1411,
    "dano_heroi_medio": 16036.9988,
    "cura_media": 1131.8789,
    "stuns_medio_s": 36.2346,
    "duracao_media_vitorias_min": 38.8371,
    "vitoria_por_duracao": {
     "menos_30min": {
      "n": 216,
      "taxa": 0.4861
     },
     "entre_30_40min": {
      "n": 282,
      "taxa": 0.5035
     },
     "mais_40min": {
      "n": 303,
      "taxa": 0.5842
     }
    }
   }
  },
  {
   "hero_id": 10,
   "slug": "morphling",
   "posicoes": {
    "n_total": 871,
    "distribuicao": {
     "pos1": {
      "n": 767,